{
  "schema_version": 2,
  "profile": "synthetic-noor",
  "taken": "2026-10-11T20:47:25Z",
  "texts": {
    "27fe26a05e222c0e959e02a8533e55506f6a010ea1fa9aba2d36aedad471ddf4": {
      "path": "synthetic-noor/04-tomatoes-in-a-cold-year.md",
      "date": null,
      "origin": "file",
      "profiles": {
        "synthetic-noor": {
          "ownership": "own",
          "decided": "2026-09-26",
          "decided_by": "path-rule"
        }
      },
      "facets": {
        "lang": "en",
        "type": "essay"
      },
      "words": 654,
      "holdout": false,
      "status": "active",
      "cached": true
    },
    "437d17afc9fbc5e422716cf39fd1dc22c45c3ef5b8e794d8be2362776741fec8": {
      "path": "synthetic-noor/08-reading-the-sky.md",
      "date": null,
      "origin": "file",
      "profiles": {
        "synthetic-noor": {
          "ownership": "own",
          "decided": "2026-09-26",
          "decided_by": "path-rule"
        }
      },
      "facets": {
        "lang": "en",
        "type": "essay"
      },
      "words": 639,
      "holdout": false,
      "status": "active",
      "cached": true
    },
    "5f9d5c57e0a43d143176d988cbc1e80987f1becfd4dd729d1aeef1c75f114491": {
      "path": "synthetic-noor/06-the-ladder-next-door.md",
      "date": null,
      "origin": "file",
      "profiles": {
        "synthetic-noor": {
          "ownership": "own",
          "decided": "2026-09-26",
          "decided_by": "path-rule"
        }
      },
      "facets": {
        "lang": "en",
        "type": "essay"
      },
      "words": 650,
      "holdout": false,
      "status": "active",
      "cached": true
    },
    "aad6da77296c74edfc84d05f04a50f2ea603a62d98f67bdc7631bc8c6e29c790": {
      "path": "synthetic-noor/02-lentil-soup-on-a-tuesday.md",
      "date": null,
      "origin": "file",
      "profiles": {
        "synthetic-noor": {
          "ownership": "own",
          "decided": "2026-09-26",
          "decided_by": "path-rule"
        }
      },
      "facets": {
        "lang": "en",
        "type": "essay"
      },
      "words": 680,
      "holdout": false,
      "status": "active",
      "cached": true
    },
    "aaed112c5fdf1cd15faf61b363014673c718a8e321722969d3050cb66c600853": {
      "path": "synthetic-noor/07-sharpening-on-a-sunday.md",
      "date": null,
      "origin": "file",
      "profiles": {
        "synthetic-noor": {
          "ownership": "own",
          "decided": "2026-09-26",
          "decided_by": "path-rule"
        }
      },
      "facets": {
        "lang": "en",
        "type": "essay"
      },
      "words": 680,
      "holdout": false,
      "status": "active",
      "cached": true
    },
    "cf522b12da7f3f023cbed3fe6039ddcc83dbf939596a59746d0f8684f8e4350a": {
      "path": "synthetic-noor/05-the-shed-bench.md",
      "date": null,
      "origin": "file",
      "profiles": {
        "synthetic-noor": {
          "ownership": "own",
          "decided": "2026-09-26",
          "decided_by": "path-rule"
        }
      },
      "facets": {
        "lang": "en",
        "type": "essay"
      },
      "words": 680,
      "holdout": false,
      "status": "active",
      "cached": true
    },
    "e12d84260dc2affc2928c9d6c9620ef373efe401a89db0661782aebfb3459f74": {
      "path": "synthetic-noor/12-painting-the-fence.md",
      "date": null,
      "origin": "file",
      "profiles": {
        "synthetic-noor": {
          "ownership": "own",
          "decided": "2026-09-26",
          "decided_by": "path-rule"
        }
      },
      "facets": {
        "lang": "en",
        "type": "essay"
      },
      "words": 689,
      "holdout": false,
      "status": "active",
      "cached": true
    }
  }
}
