{
  "schema_version": 2,
  "profile": "samuel-mcchord-crothers",
  "taken": "2026-10-11T20:47:25Z",
  "texts": {
    "0b24937477a8135e68c13f1dfb2d9f3ae7a5225f94b4060ec628b1e809ef3c61": {
      "path": "samuel-mcchord-crothers/01-the-pardoner.md",
      "date": null,
      "origin": "file",
      "profiles": {
        "samuel-mcchord-crothers": {
          "ownership": "own",
          "decided": "2026-09-26",
          "decided_by": "path-rule"
        }
      },
      "facets": {
        "lang": "en",
        "type": "essay"
      },
      "words": 4359,
      "holdout": false,
      "status": "active",
      "cached": true
    },
    "0c23f4a952be463d465fec937ed6e9136b42a7dc5af8689d7a4fd370f0757e0d": {
      "path": "samuel-mcchord-crothers/11-the-cruelty-of-good-people.md",
      "date": null,
      "origin": "file",
      "profiles": {
        "samuel-mcchord-crothers": {
          "ownership": "own",
          "decided": "2026-09-26",
          "decided_by": "path-rule"
        }
      },
      "facets": {
        "lang": "en",
        "type": "essay"
      },
      "words": 4079,
      "holdout": false,
      "status": "active",
      "cached": true
    },
    "26feb7c027067febbe7ef8cecae8231c8a53bad57785002eb0037fd8b466fea9": {
      "path": "samuel-mcchord-crothers/08-a-saint-recanonized.md",
      "date": null,
      "origin": "file",
      "profiles": {
        "samuel-mcchord-crothers": {
          "ownership": "own",
          "decided": "2026-09-26",
          "decided_by": "path-rule"
        }
      },
      "facets": {
        "lang": "en",
        "type": "essay"
      },
      "words": 4363,
      "holdout": false,
      "status": "active",
      "cached": true
    },
    "38e6518e3ad7d537bcd6e9a5fb8455cad6da87afcc80081277390c0235e8bcf1": {
      "path": "samuel-mcchord-crothers/02-unseasonable-virtues.md",
      "date": null,
      "origin": "file",
      "profiles": {
        "samuel-mcchord-crothers": {
          "ownership": "own",
          "decided": "2026-09-26",
          "decided_by": "path-rule"
        }
      },
      "facets": {
        "lang": "en",
        "type": "essay"
      },
      "words": 4508,
      "holdout": false,
      "status": "active",
      "cached": true
    },
    "6bbf8dffa5472a3fb78bb337790277398af725071a06c50a70a540321d52f680": {
      "path": "samuel-mcchord-crothers/04-how-to-know-the-fallacies.md",
      "date": null,
      "origin": "file",
      "profiles": {
        "samuel-mcchord-crothers": {
          "ownership": "own",
          "decided": "2026-09-26",
          "decided_by": "path-rule"
        }
      },
      "facets": {
        "lang": "en",
        "type": "essay"
      },
      "words": 7522,
      "holdout": false,
      "status": "active",
      "cached": true
    },
    "9df2994c14437fcc1d0842a18a0959f889008061f6377a490ce76fb05494d380": {
      "path": "samuel-mcchord-crothers/06-the-land-of-the-large-and-charitable-air.md",
      "date": null,
      "origin": "file",
      "profiles": {
        "samuel-mcchord-crothers": {
          "ownership": "own",
          "decided": "2026-09-26",
          "decided_by": "path-rule"
        }
      },
      "facets": {
        "lang": "en",
        "type": "essay"
      },
      "words": 7205,
      "holdout": false,
      "status": "active",
      "cached": true
    },
    "ad73563fdec9c8848c49b94cc267bb906dd046eb19c60de71dea7566df5e47d2": {
      "path": "samuel-mcchord-crothers/03-an-hour-with-our-prejudices.md",
      "date": null,
      "origin": "file",
      "profiles": {
        "samuel-mcchord-crothers": {
          "ownership": "own",
          "decided": "2026-09-26",
          "decided_by": "path-rule"
        }
      },
      "facets": {
        "lang": "en",
        "type": "essay"
      },
      "words": 7015,
      "holdout": false,
      "status": "active",
      "cached": true
    },
    "bafc27263c1ee8aa23f646b56f5c47b97458b5239e4e625e45387ef48c10ab3f": {
      "path": "samuel-mcchord-crothers/10-a-man-under-enchantment.md",
      "date": null,
      "origin": "file",
      "profiles": {
        "samuel-mcchord-crothers": {
          "ownership": "own",
          "decided": "2026-09-26",
          "decided_by": "path-rule"
        }
      },
      "facets": {
        "lang": "en",
        "type": "essay"
      },
      "words": 3359,
      "holdout": false,
      "status": "active",
      "cached": true
    }
  }
}
